Video Title,Video URL,Thumbnail URL,Channel Name,Description
Race Highlights | 2021 Abu Dhabi Grand Prix,https://www.youtube.com/watch?v=7QJ-N-AQJYc,https://i.ytimg.com/vi/7QJ-N-AQJYc/hqdefault.jpg?sqp=-oaymwEcCPYBEIoBSFXyq4qpAw4IARUAAIhCGAFwAcABBg==&rs=AOn4CLAmHesod5Jcyb9lcH8m8LSEAi6r8w,FORMULA 1,"An unbelievable race to end an unforgettable season... For more F1® videos, visit http://www.Formula1.com Follow F1®: http://www.instagram.com/F1 https://www.facebook.com/Formula1/ http://www.t..."
Peacock's Insane Christmas Movies,https://www.youtube.com/watch?v=kVNl1P9StSU,https://i.ytimg.com/vi/kVNl1P9StSU/hqdefault.jpg?sqp=-oaymwEcCPYBEIoBSFXyq4qpAw4IARUAAIhCGAFwAcABBg==&rs=AOn4CLCB_u686yzcte7FoUBqvzqs0pXeSg,Drew Gooden,Sponsored by SeatGeek. Use code DREW for $20 off your first SeatGeek order. https://seatgeek.onelink.me/RrnK/DREW Let's take a trip into The Void™ and watch a couple of the most bizarre...
SURPRISING LEXI WITH 24 GIFTS IN 24 HOURS!,https://www.youtube.com/watch?v=W5Viz1FosSo,https://i.ytimg.com/vi/W5Viz1FosSo/hqdefault.jpg?sqp=-oaymwEcCPYBEIoBSFXyq4qpAw4IARUAAIhCGAFwAcABBg==&rs=AOn4CLCzbQEard4_tre_63zeYxV6wk9SLQ,Lexi Hensler,"I surprised lexi with lunch on a yacht, a vacation, and 22 other gifts! @Alexa Rivera SHOP MY BRAND: https://lexillama.com"
Game Theory: Please Come Home... (Andy's Apple Farm),https://www.youtube.com/watch?v=AQOWwS-HHyA,,The Game Theorists,Special thanks to Opera for sponsoring this episode! Download Opera GX FREE! ► https://operagx.gg/TheGameTheorists & get complete CONTROL over your Ram & CPU usage! Get Your Holiday Theory...
I Got Hunted By The Military,https://www.youtube.com/watch?v=QbJJwaVdgIs,,MrBeast,"I'm not sure how they drove over that... it wasnt supposed to happen Sign up using code ""BEASTHUNT"" with current! https://current.com/beasthunt New Merch - https://shopmrbeast.com/ SUBSCRIBE..."
I Became the SMP's Main Character,https://www.youtube.com/watch?v=GWd-kVE5ZQ4,,rekrap2,This wasn't what I expected... Where I get my music: https://www.epidemicsound.com/referral/hdky6e/ -Epidemic sound- referal link ⬆ LifeSteal Discord: https://discord.gg/lifesteal...
Nick Eh 30 reacts to Spider-Man WEB SHOOTERS in Fortnite!,https://www.youtube.com/watch?v=H3SA4VYTNZ0,,Nick Eh 30,Spider-Man: No Way Home mythic web shooters in Fortnite Chapter 3 Season 1! (New Fortnite Update v19.00) 🪙 Support-A-Creator code: NickEh30 (Epic Partner) 🎮 Streamed live on Twitch ➔...
I Busted 50 Myths in Chapter 3!,https://www.youtube.com/watch?v=5Cr-IEYxfxU,,Melt,"I busted 50 of the craziest myths in the new Fortnite Chapter 3, yes I actually did 50 so make sure you watch until the end so you don't miss any of the myths! SUBSCRIBE OR I'LL TAKE YOUR..."
"Sean O'Malley reacts to UFC 269 win; Tells Daniel Cormier ""don't say stupid s***""",https://www.youtube.com/watch?v=RoIakRH8N6Y,,TheMacLife,There are lots of ways to support our brave first responders - drinking a rich & smooth Proper Irish Whiskey is one of them. http://www.properwhiskey.com VISIT: http://www.themaclife.com...
"Character Demo - ""Arataki Itto: Make Way for the One and Oni!"" | Genshin Impact",https://www.youtube.com/watch?v=iXeJ94AFZDw,,Genshin Impact,"The Vision, which was often carefully cleaned with flannel, had once been taken away from Arataki Itto. But Itto has never been discouraged. On the contrary, after overcoming various hardships..."
